{
  "source_id": "demo-camera-01",
  "session_id": "synthetic-run-001",
  "model_profile_id": "crowd_best_local_v2",
  "model_profile_sha256": "aaaaaaaaaaaaaaaaaaaaaaaaaaaaaaaaaaaaaaaaaaaaaaaaaaaaaaaaaaaaaaaa",
  "checkpoint_sha256": "bbbbbbbbbbbbbbbbbbbbbbbbbbbbbbbbbbbbbbbbbbbbbbbbbbbbbbbbbbbbbbbb",
  "tracker_config_sha256": null,
  "frame_index": 46,
  "media_time_s": 1.533,
  "captured_at": null,
  "image_width": 1920,
  "image_height": 1080,
  "observation_valid": true,
  "registration_valid": false,
  "unavailable_reason": null,
  "fully_observed_zones": [
    "north-gate"
  ],
  "confidence_semantics": "RAW_MODEL_SCORE",
  "quality": "VALID",
  "detections": []
}
